{
  "schema_version": 1,
  "id": "filesystem-mcp",
  "name": "Filesystem MCP Server",
  "type": "mcp",
  "version": "2.0.1",
  "description": "Give Claude structured read/write access to local directories",
  "verified": true,
  "tags": [
    "filesystem",
    "files",
    "local"
  ],
  "repo": "modelcontextprotocol/servers",
  "subdir": "src/filesystem",
  "env_required": [],
  "install": {
    "runtime": "npx",
    "package": "@modelcontextprotocol/server-filesystem",
    "version": "2.0.1",
    "sha256": "29fc383a93c28e42eefa643abe4b1578ddeca3f4d430e6cd4c57f1ccf2e7c379",
    "mcp_command": "npx",
    "mcp_args": [
      "-y",
      "@modelcontextprotocol/server-filesystem",
      "${HOME}"
    ]
  }
}
